jenis_hp;username;comment;likes
Xiaomi 14T;@catmoko5537;gw masih pke poco F3....msh enak sbenernya pke hp poco tp kyknya mau ganti ke xiaomi 14t pro biar update lah mumpung ada rejeki...hehe;0
Xiaomi 14T;@sirawing4202;Masih bertahan di 9t;1
Xiaomi 14T;@burungngukluks845;"Mantep amat.. 
Jd pengen gnti ni xiaomi 9pro 2020.. Syg bnyak kebutuhan";0
Xiaomi 14T;@MomokHaseum415;Selama Daily used nya david belum pakai xiaomi, gak dulu deh pakai merek itu;0
Xiaomi 14T;@nurmantyaswidodo;"Central Park terus kalo lagi test video / camera, nggak pernah ke mall lain... Why? 
Minta Margocity dong";0
Xiaomi 14T;@alifirmansyah1785;Mantul lengkap;0
Xiaomi 14T;@arrafibaslan;Bang Kali² giveaway hp bang...;1
Xiaomi 14T;@dhefhamufthazararsyad;Jadi mau beli XIAOMI seri 14T PRO  Saya masih pake REDMI NOTE 13 PRO 5G;0
Xiaomi 14T;@ubay4767;Penghemat Batre di Aplikasi Game Kudu di ganti ke Tidak Ada Pembatas,Supaya FPS aman bang, default di Batre optimise;0
Xiaomi 14T;@agungpratama8629;pada bilang banyak iklan nya,ini gw pake kok ga ada iklan sama sekali;0
Xiaomi 14T;@syaefulmaulana2367;Memang xiaomi sekenceng itu njir. Ane pake poco f5 aja ngebut nya minta ampun. Tapi kalo nyaman sih ane uda 2 taun lebih pake s21fe ga ngerasa bosen sama hape ini. Kameranya masih top notch lah. Meskipun layar udh greensabre batre udh boros tapi gmna ya samsung itu nyenengin.;0
Xiaomi 14T;@MercuryftRin;dari tim xiaomi sampe ga mau lagi nyenggol xiaomi;0
Xiaomi 14T;@edniskandar;Minat sama ini, cuman iklannya itu loh. Yah Allah, dipakai kerja bikin naik darah abangku;0
Xiaomi 14T;@minusdelapan;"hape ane MI 9T pro dah 5tahun lebih...masih joss...emang keren2 seri ""T""";0
Xiaomi 14T;@cahyabilandelan;Xiaomi 14t pro banyak iklan ga ya?;1
Xiaomi 14T;@ShiroKazui4K;"Xiaomi 14T pro / Samsung s24Fe
(Pemakaian 3 Tahun Mending Mana Bang?)";0
Xiaomi 14T;@abitiasakti5293;Setelah lihat review dsni langsung mutusin ambil xiaomi 14t pro yg 512gb setelah sebelumnya pengguna xiaomi 13t. Asli emang xioami skrang kualitas produknya gila gak pelit. Dulu setia bngt sama series opp* tp skrang jatuh hati sama xiaomi.;0
Xiaomi 14T;@SuroMulyo;Hp ini fitur fast chargingnya gila.  Fiturnya tersembunyi di pengaturan. 50% ke 100% cuma 7 mnitan.;0
Xiaomi 14T;@KickScopeOfficial;Semoga bisa beli HP ini suatu hari nanti;0
Xiaomi 14T;@arkananta8293;videonya stabil bgt;0
Xiaomi 14T;@SunDanceMusicCH;bang, krn Oppo kemarin ngelawak ngebela Reno12 Pro, plis buat video versus sama Xiaomi 14T Pro biar makin tantrum;0
Xiaomi 14T;@tatir4790;"Suka ui yg sleek tanpa iklan bisa pilih one ui samsung atau coloros oppo 

tp ya gitu deh kalo oppo mau bagus ya harus seri flagshipnya soalnya yg reno masih kerasa kurang worth to price antara harga sama features nya";0
Xiaomi 14T;@bramantyaferiyudhistira4727;Pengen beli, tapi masih ada prioritas lain yg lebih penting ketimbang upgrade hp;0
Xiaomi 14T;@randomgamingyt2750;Nnton ini disaat hp X3 pro ane udh sakit2an , niatnya bulan depan mau beli bismillah bongkar tabungan;0
Xiaomi 14T;@sriutami6429;Pilihan kk yg kutunggu;0
Xiaomi 14T;@SayurJunior1;pake xiaomi 14t pro, samsung s24 reguler n iphone 14 pro max, mau hyperos/one ui/ios enak2 aja semua, ngapain membagus2kan 1 brand n jelek2in brand lain, btw khusus 14t pro, batre minggu pertama boros, minggu ke-2 baru berasa hemat, urutan ketahanan batre mnurut pemakaian pribadi: 14pro max > 14t pro > s24;0
Xiaomi 14T;@tokyoprison.;"tambah kriteria ""adem"" di setiap review hp bg";0
Xiaomi 14T;@mashendry287;Bang review hp redmi note 9T;0
Xiaomi 14T;@reinhardteguhkristantosoed8450;Udah terlanjur cinta Sama produk xiaomi..;0
Xiaomi 14T;@dailybangwan;Masih setia sama Mi 9T pro, ini aja masih lancar banget apalagi yg 14T pro;1
Xiaomi 14T;@risaldih6169;Seneng 14 T pro bang;1
Xiaomi 14T;@TiyamzziLika;Kecewa desain kamera;0
Xiaomi 14T;@gustiahmadwahyudi8580;Akhirnya nonton review ini lagi pas kebeli xiaomi 14t pronya;0
Xiaomi 14T;@Riko6119;Lebih suka samsung bang. Alasan terbesar ku pindah dari xiaomi karena banyak iklan;0
Xiaomi 14T;@pujisantoso1931;Maaf bang nanya,iklannya masih rame gak?;1
Xiaomi 14T;@hery74susanto;kayaknya dua duanya oke , sama sama keren;0
Xiaomi 14T;@juraganonlinebarokah189;Seneng dua dua nya masalah nya ga ada duit nya kak;0
Xiaomi 14T;@anno4766;Alhamdulillah lagi nonton pake 14t pro🫶;0
Xiaomi 14T;@comelnyaallie;PENGEN BANGET INI YATUHAN;2
Xiaomi 14T;@didinjivi1427;Alhamdulillah banget dapet di harga 7,6jt di tokped;0
Xiaomi 14T;@ardiansyah2bj;masih stay di 11T Pro;0
Xiaomi 14T;@soultaker7765;adakah user xiaomi 11t pro disini ? yang lagi ngiler liat series T xiaomi yang baru2 ?;0
Xiaomi 14T;@rahmatsoetry7819;Selain dari fitur Smartphonenya saya juga senangnya di After sales-nya Xiaomi.;0
Xiaomi 14T;@natcchan;Seandainya harga varian 512GB sama persis antara S24 FE dan 14T Pro, langsung sikat S24 FE tanpa pake mikir. Tapi kalo terpaut harga lumayan jauh, saya ngambilnya 14T Pro dan sekarang komen pake 14T Pro;0
Xiaomi 14T;@z_prams7148;"Tergantung kebutuhan sii 
Lebih ke xiomi 14t soalnya engga mikir aksesorisnya lagi";0
Xiaomi 14T;@mrd2922;Alhamdulillah nonton pake hp xiomi 14T pro;0
Xiaomi 14T;@ahmadzamili962;Ada yang ngerasa nggak kalau kameranya lebih bagus yg seri 13t?;0
Xiaomi 14T;@jonrushdie;14t pro, soal iklan bisa diseting bahkan kelas bawah redmi bisa diseting agar tak ada iklannya;0
Xiaomi 14T;@anakbugies5938;Kmaren sy pke reddmi note 13 pro plus aja udah puas bngt, keren soal kamera;0
Xiaomi 14T;@netaluvofficial;"Setelah 3 tahun berleha leha dgn VIVO,
Sepertinya saya akan kembali ke XIAOMI.

Secara pribadi, VIVO yg sy gunakan selama 3 tahun terakhir masih menang buat sy dibanding iP 13 ProMax yg sejak beli cuma simpan di tas atau laci meja bahkan dijadikan oleh anak2 sy sebagai mesin pemutar video (buka youtube dengerin lagu anak2). Dan Xiaomi yg sblm nya sy pakai lumayan awet dipakai anak sy selama 3 tahun terakhir ini, bahkan naroh nya asal kadang di bawah kasur/bed, dimeja makan, dapur dll 

Tapiii setelah melihat 14T Pro di review pak David, sy akan segera otw checkout..

Btw produk Apple bagi sy hanya untuk gaya gayaan meskipun sampai skrg, sy jarang pakai produknya di depan banyak orang  saat keluar rumah";2
Xiaomi 14T;@silentchanel01;"Koq nggak pake snap dragon gen3 nya.. 
 Fitur whatshaap nya ada filter nya gk tuh kak davit??";1
Xiaomi 14T;@Buravon41006_AEUG;Alhamdulillah bisa kebeli walau telat 1 tahun tapi sayangnya pemakaian baru setengah bulan udah nampak lecet putih kecil di bagian bezel mepet layar gara-gara ketekan kuku kalo sering copot pasang casing nya.Soalnya harus begitu supaya hp gak terlalu panas kalo buat charge ya begitulah minusnya charger kencang maka hp pun akan cepat panas pula.;1
Xiaomi 14T;@kelvinpau3085;semangat bang david;0
Xiaomi 14T;@arduinojr;harga yang sama mending ini atau ip13 ? kebutuhan foto,video konten makan, video konser,video konten produk affliator;0
Xiaomi 14T;@ferryasnanjanuar2003;Masih setia di Mi 13T;0
Xiaomi 14T;@UselessGuy1;Test game nya harusnya sama bang kayak hp lain, terutama kalo di ml itu kan tiap game pasti random efek skill dll;0
Xiaomi 14T;@administrator000;Nunggu 14 T pro plus ultimate;0
Xiaomi 14T;@muhammadafifuddin131;saya yang disini masih make 11t pro beli dari hari launching masih aman;0
Xiaomi 14T;@penabangsa234;Halo para dengan gaji dibawah 1.5 juta, sini kita kumpul, kita halu bareng buat ganti hp;0
Xiaomi 14T;@radiojadulz;Mi A2 lite gw awet dibeli pas awal launching, design bagus, cover besi, mau upgrade tp ga tipe xiaomi ini, performa bagus design kayaa kompor, too bad, seakan design yg mau melangkahi iphone ada cubical kotak kamera, 2/3 oke, 4 too much...;0
Xiaomi 14T;@AZHIIMA;Gw user 13T dulu mau beli susah banget carinya. Puas bgt yampe skrg pakainya;0
Xiaomi 14T;@ahmadamirrulhuda4375;Koment pake Xiaomi 14 t tapi sayang udah PO nggak dapet apa apa;0
Xiaomi 14T;@shahrizal7556;akhirnya kebeli bang;0
Xiaomi 14T;@chikoofficial;"Apa cuma aku yang nyari video test ip68 dibawa nyemplung hp xiaomi 14t pro ini tapi gak nemu juga???

Jadi ragu mau bawa hp ini nyemplung atau main air 
Bang David @gadgetin tolong infonya dong";1
Xiaomi 14T;@Qevongame;info tukar tambah 13T ke 14T pro;0
Xiaomi 14T;@chandrakristanto5675;Xiaomi 14t pro sy sebulan lgsg ghost touch;0
Xiaomi 14T;@AMANGRUPACHANNEL;MANTUL BRO;0
Xiaomi 14T;@kohipungkohipung1088;"Nangis liat ini ,,habis liat"" review 13t barulah beli 13t 2bln lalu ehh skrg keluar deh yg 14t  mana selisih 300ribu sama harganya aku beli 13t";0
Xiaomi 14T;@nandaekaramdoni;Makin keren aja Xiaomi;0
Xiaomi 14T;@gavinshorts5758;Nungguin siapa kamera Terbaik di rekomendasi bang david untuk akhir tahun ini;0
Xiaomi 14T;@jakop352;Spek bagus harga lebih terjangkau tapi designya tidak disukai semua orang;0
Xiaomi 14T;@dianbangun4021;Masih Stay di 13T;0
Xiaomi 14T;@ariefkahulta7;Tadi promo 10.10 dapat 14t pro yang 12/512 di harga 7.98 jt di official store. Di reseller official dapat 7.8 jt an. Kalo nunggu 11.11 bakalan lebih lagi gak diskon nya daripada tanggal kembar lain? Siapa tau ada yang punya pencerahan;0
Xiaomi 14T;@muh.tirtajanuramadhan2487;Masih nunggu video perbandingan 14T sama 14T pro nih bg wkwk;0
Xiaomi 14T;@GhifariNaufall;Mantap...;1
Xiaomi 14T;@EdiAlmubarok2011;Alhamdulillah udah pake Xiaomi 14t pro,, bagus banget kamera Leica nya, penyimpanan yang luas ,,ngecas ngebut game berat libas smua rata kanan,,pokok nya enak sih make nyaa,,,,;0
Xiaomi 14T;@mangabdulchannel;Nonton pake 12T udah mau 2 tahun;0
Xiaomi 14T;@mbima.0k;"BANG MENDING MANA 
-Iqoo 12
-xiomi 14T pro
-iphone 14 promax
Bang?";0
Xiaomi 14T;@allrole_99;Telat 3 bulan lihatnya, semoga tahun 2025 ini bisa kebeli aamiin;0
Xiaomi 14T;@ronichroni6963;"Halo bang,, siap"" riview HP barunya dari xiaomi yaitu resmi note 14 pro+";0
Xiaomi 14T;@Ivana-ld3eu;"Masih pake 12t aman"" aja si tp saran cari xiaomi yg pake Snapdragon aja deh  walaupun buat game lancar jaya tp buat pake aplikasi banyak kadang kek gimana yaa";0
Xiaomi 14T;@michaeljonathanraharjo795;Kualitas flagship di harga mid-range, oke banget memang xiaomi 14T pro!;0
Xiaomi 14T;@kmaeha;0:42 yang ini narasinya keren si bang, bisa nyambung gitu;0
Xiaomi 14T;@muh.arsalumarbakri3073;Liat dr ip xs yang supper ngelag kalo buat main game pas panas... Rencana pengen up ke 14 T pro.. nah iseng2 beli cooler dipake buat genshin rata kanan 60 fps aman sentosa.. ga jadi upgrade bang..wkwkk;0
Xiaomi 14T;@ace_athallah;bang, rekomendasi ex-flagship yg kameranya masih sangat worth it di 2024 dong;0
Xiaomi 14T;@AjiPgstu-sd9jv;Jujur aja semenjak punya ip, HP andorid mana pun ga pernah lagi tertarik gw;0
Xiaomi 14T;@ugotagreenapple007;keren banget reveiew nya....;0
Xiaomi 14T;@xiaovens6369;Ko modelnya mirip bgt infinix;1
Xiaomi 14T;@romoidris6675;Amin....bisa;0
Xiaomi 14T;@Mike_Savin;Jelas pilih Xiaomi 14T Pro;0
Xiaomi 14T;@hafidharrosyid2998;Alhamdulillah udh  ngerasain mito limbad;0
Xiaomi 14T;@Fogship;"Menunggu rekomendasi hp akhir tahun  plis infoin kalo ada iklan dalem hpny  auto skip soalnya
Dan menunggu review iqoo, vivo & oneplus";0
Xiaomi 14T;@BagasSaputra-d3w;Kalau dibandingkan dg produk vivo yg sekelas nya.. Bagusan mana yaa;1
Xiaomi 14T;@choirikaraska3665;Bingung 14T pro atau Poco f6;1
Xiaomi 14T;@cemilanendul;masih pake 11t Pro sampe sekarang masih ngonten belum bisa moveOn ,;0
Xiaomi 14T;@pasirputih9430;review laptop 2in1 dong, butuh bgtt;0
Xiaomi 14T;@iisariska1736;Xiaomi 14T pro vs Iphone 13 ?? Mau beli tapi bingung mau pilih yang mana.;0
Xiaomi 14T;@arghaabrian6172;xiaomi bukan badan amal;1
Xiaomi 14T;@supriyadi4681;Mudah2an ada upgrade di bagian kamera dan ada bberapa fitur yg gk ada di brand laen;0
Xiaomi 14T;@ndyjaya4150;Apalah daya yang masih betah dengan android 11;0
Xiaomi 14T;@digitalfuturemerdeka;Nungguin 15T ajalah;0
Xiaomi 14T;@RudiErshi;Gua suka bank cameranya .;0
Xiaomi 14T;@brasbrus208;Samsung tab s10 bg;1
Xiaomi 14T;@iskandarr3507;Xiaomi 15 pro mna bg?;1
Xiaomi 14T;@sakRRRRRRRJFJIF;Hp impian ku;0
Xiaomi 14T;@YayanHandrio-w4m;Lombok Timur Ntb lotim selalu hadir nonton nya;0
Xiaomi 14T;@servanisti;Aku nunggu 15 T pro aja deh bang;0
Xiaomi 14T;@rizaluntung182;Sejauh ini udh puas pake Poco X6Pro,buat daily driver,buat ngurir juga;0
Xiaomi 14T;@alifahadzwa5696;"Team xiaomi  14 T pro
Baru beli 4 hari lalu";0
Xiaomi 14T;@billyftrr;mending ss 22ultra atau 14t pro ya?;1
Xiaomi 14T;@dimm8809;Vidio 4k 60fps nya bagus banget dah kek ip;0
Xiaomi 14T;@Fahrilekk;mending xiaomi 14T pro apa xiaomi 14 bang;0
Xiaomi 14T;@finzydevofc;BANG COBA XT14PRO VS OPPO RENO 12 PRO;1
Xiaomi 14T;@iksansaputra366;Mending xiaomi 14T biasa apa yang pro?;0
Xiaomi 14T;@VincentAmadeus;nunggu 15T yg baterai sudah 6000mah brooo;0
Xiaomi 14T;@RioKupatra;Hp idaman;0
Xiaomi 14T;@DahrudinM-pd1rj;bang, coba sekali-sekali bahas kamera. Budget mulai 3jt an tapi bagus;0
Xiaomi 14T;@widyaamalia5297;Harganya kan setara sm IP 13 saat inu bang, maaf nanya ini kl menurut abang hasil foto dan videonya bagus mana?;1
Xiaomi 14T;@ahmadnahnudin704;Apa cuma gw yg gak suka xiaomi.;0
Xiaomi 14T;@munawwirfahmitv;Kamera hp skrg ampun dah gede2 bgt;0
Xiaomi 14T;@yudikrestanto3721;Yang suka custom mending xiaomi, kalo suka gampang ya samsung;0
Xiaomi 14T;@rombeng374;Review vivo x100 pit;1
Xiaomi 14T;@Rafm1236;sama Iqoo 12 berani lwn kah?;0
Xiaomi 14T;@AMANGRUPACHANNEL;MANATAPPPP XIAOMI;0
Xiaomi 14T;@RamaDhani-hr7ei;Tim performa;0
Xiaomi 14T;@yan..5131;Alhamdulliah udah kebeli,dah sebulan pemakaian josspar️‍;0
Xiaomi 14T;@kiagengarit870;Bingung mau pilih mana tambah dikit dapat iqoo 12. Sekarang barunya 9jtan;0
Xiaomi 14T;@liputardonghua;Nunggu turun ke 6 juta;0
Xiaomi 14T;@joelchannel2389;PINNED TAHUN DEPAN BELI XIAOMI 14T PRO!!;0
Xiaomi 14T;@hardiman5037;Pusing beli Xiaomi14T Pro atau iP13 ya;0
Xiaomi 14T;@danbodroid;Saya sekarang kalo gak Xiaomi yah Apple aja. Budget 10jt kebawah Xiaomi. Diatas 10jt yah Apple. Soalnya lumayan lama pakai Samsung feel nya udah gak dapet. Entah kenapa.;0
Xiaomi 14T;@mayorjenderaligorkonashenk6348;7 : 25 itu di exit B MRT sebelah dubes Jepang ya bang ? Saya kalo lihat itu lagi sedih jaman jadi ojol ngarepin dapat orderan sampai panas panasan. Blm lagi sering di usir sama security.;0
Xiaomi 14T;@ARDA.2.9;Ada game turbo ga. 5:20;2
Xiaomi 14T;@jeriefamjongste7812;Yg dibutuhkan dari HP jaman dkrang, ketahan batre, performa, camera  performa nomor 2 karna emg jrang maun game di mobile ya;0
Xiaomi 14T;@2rsarsnihbos944;Bang rekomendasi hp harga 4 jutaan buat main game bangg,  klo bisa kameranya mayan bagus lah;0
Xiaomi 14T;@arfanatrainzedit126r;Bang kalo untuk kamera mending Xiaomi 14/Xiaomi 14 Pro/Xiaomi 14T/Xiaomi 14T Pro/Xiaomi 15/Xiaomi 15 Pro bang?;0
Xiaomi 14T;@moxxieme;Nonton ini dari RedmiNote 10Pro.. Diaminin dulu;0
Xiaomi 14T;@rahmadfadli9394;Bg saran donk ,, siapapun di komentar ini ,, sya mau cari hap 3 juta kebawah ,,kalau bisa merekam video sampai stu jaman lebih buat praktek ngajar;0
Xiaomi 14T;@RiOnel10;skrng review yg regular bg;0
Xiaomi 14T;@roseyred1999;14t pro vs v50 mending mana guys?;0
Xiaomi 14T;@hashirehashire;"Mending xiaomi 14t pro atau vivo v40 ? 
Untuk ngonten yg butuh kamera";0
Xiaomi 14T;@NistorGenZ;Samsung S24 Fe sudah tersedia 8/512;0
Xiaomi 14T;@Hanifachaneltrenggalek2019;2 tahun lagi harga 3 juta an;1
Xiaomi 14T;@CHANELDJ-j8w;Saling do'ain ya temn teman  semoga bisa kebeli;0
Xiaomi 14T;@troya9346;Abis beli ni hp.skor antutu gw 2jtaan. Puas sih sama hp nya..;0
Xiaomi 14T;@meliodassama1926;Wkwk gw make mi 10T pro aja sadissss bet apalagi dah yang kureng ,oiya matotnya xixixi;0
Xiaomi 14T;@putrajaya1809;Alhamdulillah baru kebeli buat game josshh;0
Xiaomi 14T;@yuhide;Desain kamera Xiaomi 13T / 13T Pro Lebih bagus sih, coba pakek desain yg sama pasti mantep;0
Xiaomi 14T;@abdurahmanazmi3733;Ngga ada test gaming nya.. kaya ada hambar nya gitu..;1
Xiaomi 14T;@nabsfhr21;Tolong bagusan mana Xiaomi 14T dengan redmi note 13 pro 5G? 🥹;0
Xiaomi 14T;@punyatabungan;Xiaomi forever lah bang eh maksudnya Redmi forever;0
Xiaomi 14T;@ErwindBernaddus-il3hz;Untung pas ganti driver harian note 9pro gak diganti jadi gampang dipindah data nyapas cair Tpro yang ini tujuan selanjutnya, hassiiikkk;0
Xiaomi 14T;@MrSuperKunil;HP nya gaib, udah pada habis aja yang 14T Pro di toko offline nya;0
Xiaomi 14T;@adnanaryanto4877;Fix gue beli besok;0
Xiaomi 14T;@Yogaly86;Masih galau si di satu sisi gua sudah pake ip hampir 3 th pengen ganti di harga 9jt an ada ip 13 sama ni hp jadi bingung ada mode cinematik nya gak si xiaomi 14T pro ini  tolong galau yang sebenarnya ini;0
Xiaomi 14T;@snssnss;"Emmm mau beli tapi, ini poco X3 NFC keluaran 2020 sampe sekarang main ML san PUBG masih enak lancar jadi nanti lagi lah... 


Mungkin pas udah lag  tapi masih enak padahal kan udah 4 tahun nice sih xiaomi";0
Xiaomi 14T;@Kurozero00;Alhamdulillah nonton ini pakai hp redmi note 9;0
Xiaomi 14T;@ihsanbahtiar98;hah masa seri xiaomi masih ada iklannya? perasaan pake xiaomi 12 gak ada iklannya deh, ada tapi bisa di non aktifin dan stlh di non aktfin bener2 hilang;0
Xiaomi 14T;@echaburhani5601;"Untuk konten kreator 1.xiomi 14t pro (foto)+ insta360 ace pro 2 (video) = rp 16jtan dibanding 2.iphone 15 pro max 256gb = 27jtaan 
Saya pilih yg no. 1";0
Xiaomi 14T;@Jendela_Dunia_Kita;Layarnya ada corning gorila glass nya gak ya ??;0
Xiaomi 14T;@suwandasudirman8592;"Camera Xiaomi d belakang 
Ampun dah";0
Xiaomi 14T;@teddypr1150;14T pro baru sama 14 harga nya gak terlalu beda jauh,jadi bingung loncat 14 atau 14T pro;0
Xiaomi 14T;@prasetyawijaya5747;Seneng Xiaomi 14T Pro;0
Xiaomi 14T;@taufiqhidayat5051;Kamera 13t vs 14t bagus mana?;0
Xiaomi 14T;@iiebzzzz7074;"Setelah 2 bulan sejak video ini di tayangkan, ..

Baru kebeli sekarng alhmdllah";0
Xiaomi 14T;@CleoPatra-s6n;Wihhh kek nya gak perlu nunggu ip 16 lagi deh, soalnya aku ngincer perform nya di game sama kamera belakang;0
Xiaomi 14T;@lesehancaksunar810;Aku tak nonton ja deh hhhh. Msh pake poco f5. Blom ada dana mau up hehe;0
Xiaomi 14T;@dickychandra567;Sambung green saber light melamun;0
Xiaomi 14T;@HerdiDiansah-t4m;Nonton  pake Xiaomi 14 T pro;0
Xiaomi 14T;@AhmadSofyan-n5t;Kira2 kapan unboxing hp yg cameranya khusus buat live misteri/horor gtu bang....;0
Xiaomi 14T;@pujiadimassaid7164;Mending 14T Pro atau Samsung S24 Fe ya?;0
Xiaomi 14T;@feliscajieretno619;Makin yakin beli 14T Pro;0
Xiaomi 14T;@MarbotAsyifa-p4t;kalkulatornya lebih empuk.... nggamnari ngasih harga sesuka sukanya;0
Xiaomi 14T;@rustamchan1952;Techno spark go 1 sama 30c David . Dtgu unboxing nya;0
Xiaomi 14T;@sekitarpantaijayanti2714;Sejak 2019 saya pake xiaomi note 8 pro 2018 sampe sekarang masih hidup walaupun uda ganti LCD sekarang tombol volumenya malah ngumpet;0
Xiaomi 14T;@muhammadbahruddin4028;Come on iklannya;0
Xiaomi 14T;@abdulghofur7089;"saya seminggu pakai 14t pro. rasanya mudah hangat. lebih2 kamera aktif malah panas sekali. 
apakah ini normal?";0
Xiaomi 14T;@broadsword_1325;Flagship nya Xiaomi tetep ada iklan nya;0
Xiaomi 14T;@faisalachmad2966;Baru check out 14t pro 256gb. Dpt harga 6,4 wkwkwk;1
Xiaomi 14T;@dlzxxx1;Yang  Xiaomi 15 Pro 5G kpn bg;0
Xiaomi 14T;@ismulazim6961;Gajadi beli 2 2 nya deh wkwk betahan ajalaj sama vivo v 30 5g gua ini;0
Xiaomi 14T;@giriiartha1405;camera xiaomi tinggal downloadin google camera dah mantep :D;0
Xiaomi 14T;@Yockhy09;Nah masuk di list...;0
Xiaomi 14T;@RioSigit-w5n;Xiomi 14t pro atau poco f7 pro?;1
Xiaomi 14T;@gmcsultanahmad2053;masih setia sama Xiaomi 12 T;0
Xiaomi 14T;@umamharirul;"Banggggg banggggg banggg
Unboxing Xiomi 15 atau 15 Pro banggg!";0
Xiaomi 14T;@iyusatahajo1251;Ampun setabilnya, gileeeee..... switch ngak ya dari samsung;0
Xiaomi 14T;@aldodarma1856;Sipp gw bakal ganti ini;0
Xiaomi 14T;@WMMT_Toru;Bang, kapan mystery box lagi hehehe;0
Xiaomi 14T;@Kakak_Mirza;Masih stay renot 9 pro, masih bandel ya meski kadang2 ngfreze hrs restart. Pemakaian 4thn++;0
Xiaomi 14T;@vancetube;Oddo gamau dikritik tu bang;0
Xiaomi 14T;@4ly471;di banding sama v40, pilih bagus yang mana nieh?;0
Xiaomi 14T;@nandana5196;Sayang desain kamera nya terkesan murahan;1
Xiaomi 14T;@yudianggriawan559;mending Xiaomi 14t pro atau IQOO 12 ?;0
Xiaomi 14T;@mixbyJM;Kok 14T pro gw batrenya cepet buanget habis ya? Dibanding Samsung A72, lebih awet batre A72;0
Xiaomi 14T;@Elrasheeeeeed;Tim yg lagi nunggu riview TWS rekomendasi terbaru dari bg david;0
Xiaomi 14T;@REVOLUSIONER-ONE;Ga peduli kamera yg penting peforma;0
Xiaomi 14T;@horeeeasek9081;2:41 kok pnya gw g ada efek charger gitu y, cara munculin efek gitu dimana kasih tau dong soalnya pengguna baru ximi;2
Xiaomi 14T;@yaallahyarosullalllah2492;banyak yang kecewa liat di shope komentar yg udah beli Xiaomi 14 T pro!!!!;0
Xiaomi 14T;@rickysaefulmilah-i1k;Samsung is desain minimalis mewah;0
Xiaomi 14T;@adzfebriy1558;Waduhhhh enak kali tuhhh;0
Xiaomi 14T;@biggieme4561;Nonton video ini pake Xiaomi T 14 Pro;0
Xiaomi 14T;@angkygah;Lensa Ultrawide nya lebih cocok digunakan untuk sore hari saja di jam 4;0
Xiaomi 14T;@deniutama4439;Kalau model nya seperti note 14 pro plus wih pasti lebih mantul;0
Xiaomi 14T;@FahrurRosi-pj2kt;Bagaimana di bandingkan dgn IQOO 13?;0
Xiaomi 14T;@robbyaufarajib2596;Hp yang sekarang iphone 14 pro worth it ga sih kalo pindah ke xiaomi 14t pro?;0
Xiaomi 14T;@samsularifin8022;redmi note 14 pro bang;0
Xiaomi 14T;@rizalfirdaus6990;Nonton pke samsung s7 edge, semoga bisa ganti sama hp ini;0
Xiaomi 14T;@Novembersaa;Memang penampilan nya kurang keren,tapi mesinnya keren abis;0
Xiaomi 14T;@vickysanjaya8440;Iklan masih bisa di atur,Untung performa game dan adem itu yg jarang;0
Xiaomi 14T;@sasmitasari7804;Nonton ini pake redmi note 8 berasa purbakala banget nih hp gue;0
Xiaomi 14T;@SaflisStPahlawan;Iklannya itu berasa penipuan aja, gak akan dapat itu wireless charging dan giftsetnya, kalo memangnya jumlahnya sangat terbatas cuma 10 biji ya bilang 10 biji dan mana  iklan berhari sampe sekarang;0
Xiaomi 14T;@yudhawirapratamaabdillah9430;Emang cakep banget sih;0
Xiaomi 14T;@Djarot_Official;Ternyata hpnya panasssssss;0
Xiaomi 14T;@handryhundoma;Nonton review Xiaomi 14T pro pakek Xiaomi 14T pro;0
Xiaomi 14T;@riyadisugengr3776;Sarannya dong, mending Poco c65 atau redmi 13c;0
Xiaomi 14T;@zee-x1j;Denger ga tuh bang david bilang apa lebih bagus redmi 14c desain kamera nya wkwk bang david pun sadar emng jelek desain kameranya xiomi 14t series ini;0
Xiaomi 14T;@DaudKurnia;ada yang pernah pakai kameranya apa ada fitur telemprompter seperti di Xiaomi T13?;0
Xiaomi 14T;@wellytandela3395;Hp gaming terbaik yg adem bang;0
Xiaomi 14T;@bali_paradise-y3s;gila tambah mahal aja xiaomi sampe ke 9 juta;0
Xiaomi 14T;@alfianrenz9466;Gila nih hp op banget;0
Xiaomi 14T;@vhyscarlett;Xiomi 14T pro disini ada 12GB+1T bang harga 4.999 HKD otw beli gak sih kalo dirupiahkan kurleb 10jt an;0
Xiaomi 14T;@Ceramahmuslimtea;recomend hp buat ngedit dong bang;0
Xiaomi 14T;@Muhamad_Fairuz_Ramadhan;buat garansi xiaomi juga sedess betul bang, gw claim garansi xiaomi 12t karena lcd bergaris, dan karena stok lcd ga ada mau di ganti unit baru xiaomi 12t tapi stoknya pun ga ada jadii di refund seharga hp pas dulu beli 6,6jt. gw ngeraasa hoki bgt bisa langsung upgrade ke xiaomi 14t atau nambah dikit ke 14t pro. cmn skrng galau mending mana yaa xiaomi 14t pro atau iphone 15 128gb dari segi kamera dan video;1
Xiaomi 14T;@ozoneoxide;di senggol sma cmo oddo bang;0
Xiaomi 14T;@ogemig;sy pakai 13 t kenapa tidak sesuai harapan padahal harga 6,7 jt;0
Xiaomi 14T;@tasriahria3403;Bingung bagt antar Xiaomi 14pro sama Samsung s25+ ...tolong sarannya bang;1
Xiaomi 14T;@arl06ychanelfebryanto66;Jadi xiaomi apa yg ngk ada iklan?;0
Xiaomi 14T;@aidanurfadila1853;Ada yang sama kah pake 14T pro cuma Wa ig shopee tapi Suhunya Panas?;0
Xiaomi 14T;@nikorizky9536;bentuk kamera xiaomi 14T pro jelek, saya punya xiaomi 13T pro ram 12/256, bentuk kameranya cakep performanya mantap, saya jual ganti s24 ultra;0
Xiaomi 14T;@wahyusakitgm1604;Larang dapitku. Ga kuat tuku.;0
Xiaomi 14T;@fajarariehidayat;Seharga samsung s24 fe dan iphone 13;1
Xiaomi 14T;@rahmatbagas1788;KO BISA TAU KALO MAU MAKAN CARI CARI VIDEO GADEGTIN DUDLU;0
Xiaomi 14T;@Ojie-u8p;"10:25  ia emang benar kayak Kompor 4 Tungku.

Padahal udah bagus,keren Desain Kamera 13T ,Seharusnya di 14T Series ini ia pertahankan desain yg cuma beda setaun.";1
Xiaomi 14T;@Gamping_short;Mending mana redmi sama xiomi serius nanya;0
Xiaomi 14T;@ecdhgbbrvtht1094;Ada yang ngerasa sama? Kamera xiaomi 14t pro saya terlalu mudah fokus ke suatu objek sehingga jadi gampang blur disekitar objek tersebut,jadi susah kalau mau foto objek dekat kayak mau fotoin kertas tugas kuliah atau semacamnya, gimana ya cara ngatasinnya?;1
Xiaomi 14T;@fitricihuy8068;Bang bikin rekomendasi hp 3 JT kecil terbaik THN 2024;0
Xiaomi 14T;@rainyendahl;Pake sams*g flagship (fl*p4) malah ringkih blm setaun dah masuk service..mending ini kmn mana;0
Xiaomi 14T;@najiyaulfa111;Mending iphone 12 pro atau xiaomi 14 T pro ini bang?;0
Xiaomi 14T;@panjiarief6578;Xiaomi T14pro...;0
Xiaomi 14T;@rhesafaizdesatria5519;Banyak Juga Bang Koleksi hp Buat Simpanan tuh Kayaknya;0
Xiaomi 14T;@aldymusk;Kocak malah downgrade design, lebih better 13T;0
Xiaomi 14T;@trielectronik9929;Skrng dah redy kak bejibun;0
Xiaomi 14T;@Ishtarith;Bg udah lama nih ga bahas Bluetooth speaker, bahas ga si?;0
Xiaomi 14T;@JodiPrayatma;"Nnton gara"" baru beli Xiaomi 14 eh nongol yg ini";0
Xiaomi 14T;@nhdnhd3002;Kalau saya lagi  nunggu redmi 14 pro plus, apakah stelah rilis di indonesia nanti,  hp tsb masih tangguh artinya tahan terhadap bantingan, rendaman & jeruan dalam TDK terkurangi mohon infonya om sukses selalu....;0
Xiaomi 14T;@BronyTheCat;Mnrt gua mending Samsung s24 fe sih, cb kalian bandiingin rec vid n kamera .. auto menang sih .. tp selain nya kamera gua pegang 14t pro ini emng diatas s24 fe si ..;1
Xiaomi 14T;@Myun156;yang nonton pakek grafik 360;1
Xiaomi 14T;@ULTANEMA88;ngefans TNI ya mas.........XT14PRO mantul;0
Xiaomi 14T;@pwfx;Mantap bang;0
