jenis_hp;username;comment;likes
Samsung A56;@MIKCHANEL-q2w;A53 jatuh sekali punyaku langsung rusak dibawa ke servis hp katanya mesin nya kenak udah 1 th lalu;0
Samsung A56;@sentotwidodo4192;Digenggam n diremas;0
Samsung A56;@fansyaelfirantama2870;"M31 aja ini masih normal dipakenya
Beli 2020 wkwkwkk
Buat jangka panjang udah paling bener iphone kalo gk yg samsung.
Garansi update panjang.
Kalo yg duitnya banyak sih gpp beli hape cina aja yg 2-3 tahun mentok update sistem";0
Samsung A56;@dimasramadhan9517;Ada link pembelian adaptor charger nya bang;1
Samsung A56;@RoshaRahayu;Buat bikin konten makeup recommended gak ya,mohon pencerahannya;0
Samsung A56;@alifianirahmah1496;Mending Poco F6 apa Samsung a56 yaa ... Mohon saran;0
Samsung A56;@alfredohalim9727;2 kali pake samsung a52s sm a55 problem ny kalo udh 2 tahun suka cpu hpny rusak;0
Samsung A56;@angklungpermai2174;Nyimak dengan samsung A52S 5G, bismillah saja;0
Samsung A56;@yulinurkhasanah9568;Pengen ganti HP, tapi yg dipke sekarng hmpir 5 thun gak rusak2 Samung A21s;0
Samsung A56;@CutSriLestari-oz9gc;Samsung bagus tapi aku gak suka sama bezel hpnya yang tebel itu, padahal mahal kenapa coba gak tipis gtu jadi enak gtu...gak buat risih;0
Samsung A56;@idanwildan5499;Tapi kalo vc pake wifi itu susah banget ke sambung, terus kalo lagi voice notes juga suaranya kresek kresek;0
Samsung A56;@aprilliani4310;jadi mending samsung a55 atau a56 sih.. bingung;0
Samsung A56;@bluedawn_id;micro sd deal breaker banget, klo pake yang 256 aplikasi banyak poto video banyak;0
Samsung A56;@afifahindirarustandi6680;ada yang tau ga cara aktifin notif kapsul gini, udah coba nyari2 belum nemu (menit 6:13 );0
Samsung A56;@ojisan4795;Skip klu beli toko selain samsung official. Pasti REPACK klu di toko lain;0
Samsung A56;@andykurniawan3812;"Saya baru pake A56 2 mingguan..
Lg ngecas tiba2 casan gk jalan atw gk ngisi..
Ada yg sama gk ?";0
Samsung A56;@chazzychanz;A57 kalau ada sd slotnya, saya pasti beli.;0
Samsung A56;@DCstori25;Buat jangka panjang susah jg apalagi saya yg makaimemori 64 gb cuman 1 tahun sdh penuh;0
Samsung A56;@vieyrinnoa7257;padahal tertarik mau beli samsung a56, tapi kok gak ada microsd nya lagiii;0
Samsung A56;@TaufikekoMaulana-di7tg;saran nya bang mending yg tipe s apa tipe a ya?;0
Samsung A56;@NinaArtika;Bang, mending pilih Samsung A56 atau Xiaomi 15T Pro, ya? Untuk penggunaan jangka panjang.;0
Samsung A56;@fitriwijayaeffendy8924;Hp ku seri S baru 2 tahun udh green line dong .. padahal ga kenapa2 , ga jatoh atau apapun itu .. kenapa yaa  pengen trade in , tp takut gini lg;2
Samsung A56;@NajibAzril;Bagusan mana si a55 apa a56??? Tolong donk rekomendasi nya tmn2;0
Samsung A56;@masTaufik08;Saya menunggu episode review barang aneh .. Yg sama klik tombol jempolnya;0
Samsung A56;@SitiAisyah-b6m3t;Baru beli di siantar dapat 6juta kurang 1000;0
Samsung A56;@ekocahyowibowo2508;pake A20s dri tahun 2020 nyampe sekarang.;0
Samsung A56;@arfiannur1406;Mending ip 13 apa a56 ini ya, maaf awam;0
Samsung A56;@andrewijaya4294;Hmm mending ambil ini atau ambil samsung s24 FE yah....;0
Samsung A56;@nitaaa1954;Saya tetap suka appun samsung wkwkwkkw;1
Samsung A56;@D704NG;Bang david, kategori baterai awet itu sampe 1 hari 24 jam ga sih? Soalnya sy cuma dari baterai 98% WhatsApp dan youtube aja dan ga terlalu sering , tapi sampe malem sudah 20%? Tolong pencerahan nya. Terimakasih;0
Samsung A56;@MoralesPekei-storyline;Hp nya bagus gw baru beli kemarin;0
Samsung A56;@muhammadfahreljbzbozti4465;kenapa ya setiap make samsung setelah beberapa tahun malah ga bisa make paket data, disitu dicantumin kalau ga ada sim yang kedetek padahal aku ga pernah ngeluarin kartu sim nya, kira kira itu kenapa ya??;0
Samsung A56;@irmahfitriyani8643;Bangg kenapa ngga review s23 ??? Nungguin padahall;0
Samsung A56;@JajangMulya-b5x;Masih setia Samsung A13 awet tahan banting wkwk camera lumayanlah;0
Samsung A56;@BagoesMemasak;User a54...joz gandoss;0
Samsung A56;@Wawan_120;6:18 jadi inget j2 prime;0
Samsung A56;@aguspribadi529;Salfok duolingo nya wkwk pasti rajin nii;0
Samsung A56;@adhipradana9749;Aku dpt second baru pake seminggu 12/256 di 5,2jt. Worth banget upgrade dari a52s. Batre super awet. Ngedit pake capcut 4k preview nya langsung muncul. Di a52s gak muncul;0
Samsung A56;@muhawhy6040;masi bertahan di A52..heeee;0
Samsung A56;@hilmyalexander6434;bang review redmi pad se 11inc;1
Samsung A56;@nonaa944;Mending samsung ini apa iphone? Dg budget yg sama. Terima kasih.;0
Samsung A56;@sitamafruroh9109;Nunggu A57;0
Samsung A56;@ikukrachmanto;okeylah terima kasih.....aku ga jadi beli hape ini....ga bisa ditambahi micro SD....byeee;0
Samsung A56;@ArfanNaufal-u9k;Bingung mau beli hp apa bang;0
Samsung A56;@arskmll;Sodara gua, gw kasih iklan hp samsung a55 langsung beli dia;0
Samsung A56;@TeguhHoreg;Gile si ni hp gacorr;0
Samsung A56;@audreypratama1742;Udah setahun nih A55,, upgrade ga yaa...;0
Samsung A56;@fhrz35;masih make a52, keren sih seri A;0
Samsung A56;@sotorawon3238;Sebagus bagusnya hp kalo bezel bawah tebel, skip dulu;0
Samsung A56;@AliSatria-u2q;Samsung a56 vs Xiaomi 14t pro menang mana?;0
Samsung A56;@riyanprimajatmika5628;Minus design : kamera di satuin;0
Samsung A56;@Toscagrozpky.;Bang kalau gaming bagusan a55 atau a56 bang?, soalnya rencana gw pengen beli a56 tapi ada yang bilang a55 juga bagus bang, jadi bagus yang mana?;0
Samsung A56;@AGWelder1;Sama iphone 13 mending mana ya;2
Samsung A56;@roymoes2705;Nonton dengan kesetiaan kepada A52s;0
Samsung A56;@HannyArifah;oppo reno terbaik yang apa best?;0
Samsung A56;@GallanTubagus;Bang, kapan review Poco M7;0
Samsung A56;@masakecil2782;Untuk desainnya kamera belakangnya saya lebih suka A55;0
Samsung A56;@Nick-gq2rp;Recommend dong Poco f7/SamsungA56 ?;0
Samsung A56;@Ronin47Zai47;A56 Nah id Win;0
Samsung A56;@andipratama3772;Buat nge game enak ga bang Samsung a56 nya;0
Samsung A56;@gwenchiara7490;Lebih bagus s23 atau a56???;0
Samsung A56;@channelmasakini9812;Jadi pngen ambil samsung a56 aja kali ya ketimbang ip 12;0
Samsung A56;@ameliachernovita158;maaf agak jomplang.. kalo sma infinix note 50 pro 5g mending mana ya?;0
Samsung A56;@rahmanabilah5721;samsung a56 sama vivo v29 mending mana yaa?;0
Samsung A56;@ahmadsubhan6073;Komenan di 2.40 mirip banget flagship, iyaa lagii;0
Samsung A56;@Ilgeobdal;Buat konten vlog, video stabil gak ya untu a56 ini?;0
Samsung A56;@zanetzuugaming8113;A55 aja belum kebeli udh muncul A56 wkwk;0
Samsung A56;@fikrisadzili2147;Makasih gadgetin;0
Samsung A56;@caelvinaditya8850;Mending samsung a56 atau vivo v50 untuk waktu jangka panjang?;0
Samsung A56;@malikgulvinar1945;Saran dong teman2..hp samsung untuk pemakaian jangka panjang baik nya yg mana..A56 atau S24FE;0
Samsung A56;@iamsudarso29;Hasil videonya ada kedut2an gak bang?;0
Samsung A56;@chazzychanz;Kalau ada micro sd slot, mungkin bisa nambah beberapa persen pembelinya.;0
Samsung A56;@rijalulihsan06;Lagi menerka-nerka aja , apakah A series punya masalah layar bergaris tbtb agau tidak? Karena hp saya S21 FE bergaris setelah 2 th dan sebelumnya S9+ bergaris setelah 3 th , padahal gak jatoh , tp karena panas ketika di charge aja;0
Samsung A56;@propertydepok1232;Bang tolong rekomendasi hp 5-6jtan kebutuhan video . Yg sudah ultrawide 0,5 Terutama di malam hari . Makasih bang;0
Samsung A56;@hmdchanel31;Layarnya Rekomended untuk edit foto gak bg?;0
Samsung A56;@heroarifandi5170;Mending Samsung A56/S24 FE;0
Samsung A56;@eagleborn7138;Nonton Pake A56 5G 12/256;0
Samsung A56;@Ewinty;Pengin ganti ini.. buat ganti a32, coba pake buat pekerjaan, saya kontrak 4th apakah awet, seperti a32..;0
Samsung A56;@arulhidayat758;masih pake a52s nabung mau beli a55 eh udah keluar a56 aja :((;0
Samsung A56;@NaDirin-uc6hh;Mantap hpnya bang,;0
Samsung A56;@haraamrizal6884;Pengguna A55;0
Samsung A56;@nikehandayani6187;Bang klo punya A55 ganti ke A56 worth it gk ya?;0
Samsung A56;@caturapriani3038;"Aku ingin ganti hp ini yg dipake s10+ dri thun 2020 (mau 5 tahun) udah kena bgt layarnya bayak garis2.. agak was2 takut nya tiba2 mati nanti huhu :'(
Trs whort it ga ya kalo aku ganti hp pake yg A56 ini untuk yg suka nonton konser juga gays?? Tolong masukan nya yaa please";0
Samsung A56;@waardilsstylecollection4299;Mau beli banget tp liat review gak ada buat Memori card jadi nya miikir lagi;0
Samsung A56;@benedictusyuuji;Itu 128 ga nongol cuy dlu di seri s24 fe tuh yang 128 ga nongol cmn iklan doang;0
Samsung A56;@muhammadalfin3624;Takut bgt kena light saber sekali pake samsung S21 FE light saber banyak;0
Samsung A56;@ekapur12;enak ya setiap bikin vidio, yang nonton bisa jutaan;0
Samsung A56;@BOX_3DDJ;Kita sebut dia samsung galaxy Mark III;0
Samsung A56;@muhammadqamarul5823;Saya pake samsung s21 fe,layarnya udh garis2 apakah ada solusi buat mengatasinya?sebab klo ganti LCD biayanya disini kena 3,2 an ️;0
Samsung A56;@zuwarriyah-r3p;Kalau bandingan dengan poco f6 mana bagus bang;0
Samsung A56;@nanomiya790;"Udah pake nih hape a56 yang 256gb selama 2 minggu. Ada yang kaya saya gak ya?  Ini vol audionya suka naek turun sendiri. Gak mencet apa2 dan posisi pakai TWS baseus. 

Misalnya denger lagu 70%, tapi kadang kaya auto naek ke 80%, kadang auto turun ke 60% ... udah pake banyak model samsung, baru kali ini audionya naek turun gini.";0
Samsung A56;@irwansyairwan4046;Rencana mau beli ini buat hadiahin ke istri;0
Samsung A56;@lostvayne8120;"Saran dong
A56
14t
V50/v50
Pemakaian daily game tipis2";0
Samsung A56;@noerrahmahbellatsabita3107;Bang mending s24fe atau A56;0
Samsung A56;@DoniDoni-k3f;Cuma kl gagal update ,samsung melempem kenapa ya bang. IC langsung auto jd bangkai.  . Apakah samsung saat ini masih seperti begitu ?;0
Samsung A56;@labse3;A56 sm 14t mnding mn bg dvid;0
Samsung A56;@KooRyona;Moga kebeli bulan depan a56, soalnya ku pakai a04s udah agak lemot krn kepenuhan  mau beli iphone tapi dapet bekas budget segitu. Soalnya ku buat ngonten affliate ,;0
Samsung A56;@nikennci;Cepet panas ga?;0
Samsung A56;@LandakBBm;Bagus bener;0
Samsung A56;@herul97;Menyimak dengan A52s;0
Samsung A56;@farhanalfarabi4549;tim masih pake a52s;0
Samsung A56;@sayaferry28;Gk masalah gk ada sdcard .. nanti bisa di pindah di leptop apa hardis & bisa²nya cuma dpt kabel cas doang gk dpt kepala chargernya;0
Samsung A56;@trisnawatielisa;but, aplikasi bawaan samsung tuh banyak jdi bikin nambah penyimpananapalagi untuk yg storage kecil;0
Samsung A56;@RIFALYETE_2025;Saya juga pengen samsung a56 5G  tapi saya juga masih enak pakai samsung a50s samsung a50s aja masih awet kalau masalah pemakean mh kalau baterai merek samsung mh boros banget tapi saya paket baterai double power aja awet banget bertahan saya pakai hp samsung a50s walaupun bosan yh tapi tetep bertahan;0
Samsung A56;@Sarman-h5r;Baru 2bulan beli a55. Kluar a56. Kan kurangajar banget nama nya.;0
Samsung A56;@vpbz1;Kalo gak bisa pasang external SD card mah, sama aja kayak Xiaomi donk.;0
Samsung A56;@aryarnold9219;Masih stay di sam S23plus;0
Samsung A56;@YtMusik-bf5lu;Kalau untuk kamera yang paling bagus seri Samsung yang mana ya bg?;0
Samsung A56;@irfanyusriono-4837;"Saya pakai samsung A 51
Tapi tidak bisa getar 

teman saya juga pakai A53 juga tidak bisa getar padahal beli dari baru.
Apakah akan terulang penyakit tidak bisa getar ini?";0
Samsung A56;@hemraammar9223;Masih bertahan di samsung a51;0
Samsung A56;@Kareni.official;semoga 2025 kebeli samsung a56 5g...;0
Samsung A56;@donisafutra1319;Bg kapan review POCO F7 PRO & F7 ULTRA;0
Samsung A56;@ian.laiyagrandal4698;Buat simpan video apa!!!;0
Samsung A56;@arieyantlb7652;Sayangnya A56 nggk bisa pakek memori card;0
Samsung A56;@renisuciartisurya2290;Lebih worth it mana, ganti LCD samsung z flip 3 5g yg lcd nyavkena green line atau ganti ke samsung A56?;0
Samsung A56;@axromcahoi3650;"Asemmm...dah keluar baru lg aja seri A5. Ini aja A54 5G masih ok.
Samsung, yg pernah gw miliki. Young, ace, ace 2, ace 3, A5, A52, A6, A53, A54... seri A memang mantap, dan yang lebih mantap taterlupakan sampai sekaramg ia itu samsung A5 tpi hp nya sudah hancur.";0
Samsung A56;@Reza-qt3uz;Bang kapan Samsung A26;0
Samsung A56;@ramdhanzni;series A5* Samsung yg slalu populer dan bertahan lama,aplgi A56 ini gila rame bat dimana”;1
Samsung A56;@Ayucitra1310;Kenapa kameranya gak di design kayak a55 ajasih mnurutku lebih elegan aja kalo kameranya bulet pisah2 gitu;0
Samsung A56;@JayJay-y7w;Dan saya masih makai a54 8/256;0
Samsung A56;@MoralesPekei-storyline;6:17 Nggak Asing Notifikasi nya;0
Samsung A56;@gxpushsoenda7368;"Klo ada a55 pake aja duku a55 nunggu a59,aku pake a55 dah mantep,,,
Klo kamera jangan ngarep kaya iphone ato ato kaya hp 10 jt keatas masih burik menurut";0
Samsung A56;@NanaAja-vt2uy;dari A55 masa harus update ke A56 si;0
Samsung A56;@Azizah-z6p;gw fix ambil yang 12/256;0
Samsung A56;@zahwa_wawa;Aku paling suka design yg ini sih;0
Samsung A56;@GallanTubagus;Kapan Review Poco M7;0
Samsung A56;@raefalwidi9239;Punya bajet 8jt melar dikit mendingan ambil IP 13 atau A56 gaes. .bingung banget sumpah,,banyak yg nyaranin bajet segitu ambil IP aja mumpung udah turun,,tapi ada juga yg nyaranin kalo nggak mampu IP terbaru mendingan A56 bajet masih sisa banyak,keluaran baru,daripada IP13 yg udah tua. .;0
Samsung A56;@chandraruwetmilitan5325;A35 Senggol dong;0
Samsung A56;@mas_alfiandika;masih bertahan dengan Oppo Reno 2..,;0
Samsung A56;@taqimkeytone7144;Nonton ini pakai Oppo Reno 8 5G;0
Samsung A56;@habibhidayat4408;Masi adakah yg pake a51;0
Samsung A56;@irrwanzs;Storynya tetep pecah ya??;0
Samsung A56;@salinesolutions3033;iphone 13 yg jelas tua atau samsung a56 yg masih fresh?;0
Samsung A56;@giyonoyono2424;Coba bang diadu hp infinix..poco ...oppo..vivo dan hp hp lain yg kelas harga 2'5 s/d jt yg sepeknya bagus yg mana;0
Samsung A56;@Mr.Raf4;Masih bertahan A51 mesin masih bandel ganti lcd doang set sama baterai.;0
Samsung A56;@rickyhariawan663;Nonton Video Sambil Pake A54;0
Samsung A56;@divahereeee;A55 blm kebeli uda ada yg baru aja;0
Samsung A56;@crunchko2432;Hp ini gabisa voice chat di game jir, aku coba di pubgm sama roblox gabisa;0
Samsung A56;@bgasardiansyh;gw bingung nih a55/a56/s22;0
Samsung A56;@TheDailyLife-ng1wi;"Woah  ada mavuika ada citlali
Kaya memang";0
Samsung A56;@nadjchwaaurorairfandy59;Woy lah kata bapak ku klo beli hp Samsung aj, GK Samsung GK boleh;1
Samsung A56;@nasroel21;Kak itu di deskripsi toko oren ny kalo beli ,repack an apa bukan kak??;0
Samsung A56;@muhamad_ulung;Bang saran buat Adaptor a56 bagus pake ap yah?, yg support 45 Watt;0
Samsung A56;@ramajatayu;A56 vs A73;0
Samsung A56;@abduhal-afgani281;Serius nanya, Perlu tidak sih A56 pakai TG? maksudnya kan sudah Corning Gorilla Glass Victus+;1
Samsung A56;@r15an35;nonton review A56 di A50;0
Samsung A56;@jaychen7630;Saya pake Video 60fps di A55 lalu saya update di status wa kok bisa agak tersendat ya gambarnya;1
Samsung A56;@awiuchiha3479;review samsung A06 5G dong bang....;0
Samsung A56;@arisandy2652;Tompel kamera depannya makin lebar di banding A53 dan A54.;0
Samsung A56;@Srd736;Ka review dong hp ex inter yg dijual toko Arisa Store68 di shopee,,,mereka jual ex iphone tapi mulus;0
Samsung A56;@hidayatullah2312;Mau tanya ka beli kepala charger mending angker 45w apa ugreen 45w atau baseus 45w?;0
Samsung A56;@mieayam8323;Ada pak Ganjar di menit 12:51;0
Samsung A56;@TJEOO;Coba bahas samsung light cyber;0
Samsung A56;@Kareni.official;Tiva-tiva gua punya ini hp;0
Samsung A56;@muhammadnuzululromadhoni5329;Nonton ini dengan memakai Samsung a52s 5g;0
Samsung A56;@danisetiawan8018;Skip nunggu a56ultra aja;0
Samsung A56;@DitaAyu-p7l;kamera nya bagus a55 atau a56?;0
Samsung A56;@andriawanmayperdana1763;APAKAH AMAN DARI GREEN LINE???? HELLO SUMSANG;0
Samsung A56;@beyondyours9531;Ada ga si reviewer yg detail perihal feeling touchscreen di setiap hp yg dites, gw biasa pake iphone n samsung, trus coba beli xiaomi 12, harapannya krn harga murah fitur oke.. tapi setelah dipake, feeling ngetik n scroll beda banget sama iphone atau samsung.. ga nyaman gitu rasanya;0
Samsung A56;@hafissyirazi9796;Bg David coba review main e football 30 menit, berapa % terpakai baterainya..;0
Samsung A56;@anadles6781;Samsung a56 atau poco f7 ya?? Dari segi video,kamera dan batre;0
Samsung A56;@jehanmaliq3930;"Speaker videonya kok, kaya kurang idup yaa ?
Maksudnya, suaranya bang David kaya mampet atau berat gitu, gak bisa lancar";0
Samsung A56;@Sahirapuspa;hp nya keren simple ,kmera blakang nya ,ga gede segede gaban;0
Samsung A56;@mdevinarzico8554;Coba bandingin bang samsung a55 vs samsung a56;0
Samsung A56;@tahupetis_hitam;6 jt 128 gb no sdcard;0
Samsung A56;@SodikinMaulana-y2u;"Bang itu hp bekas rivuew di jual gak?
Lebih murah atau mahal";0
Samsung A56;@stellaclaresta4966;vs xiaomi 14T bagus mana ya kak?;0
Samsung A56;@exploreyuk;Saya masih megang Samsung Galaxy M31;0
Samsung A56;@iborpramana6339;Ga ada review speaker ya ????;0
Samsung A56;@yenniepratiwi8544;Nonton pakai oddo A96;0
Samsung A56;@dasaharyuwibawa;Nonton review Galaxy A56 pake Galaxy A55...;0
Samsung A56;@albet_Lee;A56 versi compact dong;0
Samsung A56;@SahrulHadi-z8g;Hp samsung kebanyakan minusnya sering kenak garis ga jelas di layar;0
Samsung A56;@bachrululum359;Kamera malam nya gmn bang?;0
Samsung A56;@andregustomi1556;Poco gampang rusak softwarenya, samsung lebih bandel. *menurut sayaa;0
Samsung A56;@iamsudarso29;Bagus Samsung A56 atau Poco F7 Pro ya guys ? Kebutuhan buat ngegame ringan, buat zoom kuliah, buat kerjain tugas sama online class, sosmed, nonton Youtube juga. Gmn ya guys ? Thanks;0
Samsung A56;@maulanatikarizki2575;A55 apa a56 yaa ??;0
Samsung A56;@mrgood-xq9rq;Bang Review HP INOI dong yang dari eropa;0
Samsung A56;@defina3939;gabisa pake kartu memori ya berarti;0
Samsung A56;@dailyness6384;Baru co 2 hari kemarin A56 nya;0
Samsung A56;@phyte512;"Buat maen genshin kok ngefreze ya
Padahal spek lebih bagus dari A54
Malaah lebih smooth a54 dari pada a56
Ada yang bisa bantu jawab";1
Samsung A56;@mastrader9;Kalau sama oppo reno 14f 5g kameranya bagus mana bang?;0
Samsung A56;@smolpaw;Nyimak dengan A52S;0
Samsung A56;@RikuelJaoss;Jossss;0
Samsung A56;@abdulkholik1778;Frame layar'nya kurang bagus karna msh tebel, harusnya di titipin frame layar'nya;0
Samsung A56;@ninikdwilestari7381;TT sama samsung a54 dg stroge yg sama tambah brp ya kira2 sobat gaget;0
Samsung A56;@jamalaja4529;Bang coba minta tolong ke Samsung bikin seri A TPI yang Compact, biar enak buat di pegang gitu pasti gua beli;0
Samsung A56;@kacaxmata;Mending a56 atai s23fe? Buat ngambil video saja.;0
Samsung A56;@Bayu-e7o;Bng review handphone harga 2jt ke bawah;0
Samsung A56;@R12Q-j;bagusan A series desain nya jadinya drpd S series;0
Samsung A56;@Jule-p1x;"Link shopeenya gak bisa dibuka? 

Btw kalo beli yang 12/256 harus di offline store ya? 
Di online kok gak ada";0
Samsung A56;@rifhaf2238;Brrti ttp bagusan a55 ga si;0
Samsung A56;@andreasboseke3385;Potensi green line lagi gak sebagai fitur gagal khas samsung di LCDnya ?;0
Samsung A56;@idanabef;"Saya beli A56 gara"" liat video ini";0
Samsung A56;@kopiHitam99_10;Samsung A57 5G kapan rilis nya bang?;0
Samsung A56;@DedenDanissaputra-r1k;iPhone makin ketinggalan,makin ga di liat,skarang rata2 orng liat pasar android;0
Samsung A56;@likanto96;REKOMENDASI ADAPTER SAMSUNG A56 A36 YANG ORIGINAL BANG KALAU BELI ONLINE DIMANA?;0
Samsung A56;@silfianaseptianie6830;nanya dong kalo untuk rekomendasi charger yg cocok buat dipake samsung A56 apa ya?;0
Samsung A56;@NHS-18;Apa udah cukup pakai 8gb ram gak yah?;0
Samsung A56;@bukansiapasiapa3359;Coba aja di samsung kelas midrange ada shuterspeed pasti w nukerin a53 gue sih;0
Samsung A56;@musrohwidayat5843;Serius nanya mending ss a56 / ip 13 ?;0
Samsung A56;@rizalabdurrahman1292;12:20 mantap;1
Samsung A56;@yanapermana8963;Hp 6 jt mana bisa gagal bang;0
Samsung A56;@enNwr;Yg udah pake.. review backdor dong.. nglotok kek a52 ngga? Makasih;0
Samsung A56;@AndyNn15;Overprice dan bezel always tebal. Dahlahh;0
Samsung A56;@farhanisaefi9024;Dah lama ga nonton review;0
Samsung A56;@AliZein-v7d9d;Review Samsung A 57 bang;0
Samsung A56;@noorkholis3202;Masih sering panas sama batre boros gk ya?;0
Samsung A56;@satirarumi2739;Samsung a26 kok g muncul2 si bang.padahal sudah nunggu2.sapa tau cocok buat saya;0
Samsung A56;@DudaJanda-y5v;Ini gak ada yg mau review INOI A75 elegance nih?;0
Samsung A56;@HilmiHilmi-s2h;bg mending xiaomi 14t atau smsung a56;0
Samsung A56;@bangmendes5097;Sinyalnya samsung selalu lemah;2
Samsung A56;@nesyaamalia9163;Sodara gw pake samsung flip kok ada garis hijau nya dri 1 sampe banyak itu garis²,, niat hp pengin ganti yg ini kok jdi ragu yaa soalnya samsung banyak di upgrade nya;0
Samsung A56;@kebayastore217;Tipe ram yg paling besar apa guys bantu jawab  buat usaha;0
Samsung A56;@dogamers178;bang recomend main game berat CarX Street paling berat dari ghensin;0
Samsung A56;@dqs3656;Kalo dibanding redmi note 14 pro plus bagus mana ya kak??;2
Samsung A56;@farhanaiman3169;Bahas tab s7 fe masih ok gak ya di tahun ini dibanding s6 lite ka??;0
Samsung A56;@Blangkonan1993-hh9ki;A Kind;0
Samsung A56;@muhibbulhajeh3845;bang pocco m7;0
Samsung A56;@aprilliapratiwi8497;Bner gk sih seri a sering kena greenlight, mau beli maju mundurr;1
Samsung A56;@stivenjuliansi;bang David coba review arirang phone brand nya Korea Utara;0
Samsung A56;@hafiy5170;Bang next episode 30 TWS;0
Samsung A56;@muhammadnurkhakim9717;Bang rekomen hp yang kuat nampak signal bang,soalnya pelaut bang wkwk dilaut terus bang;0
Samsung A56;@andrewphang481;Wah.. micro sd ny ...;0
Samsung A56;@restyyandrea5529;A56 layarnya emang ada efek noise/grainnya kak? User baru samsung soalnya🥹;0
Samsung A56;@wildanwil6614;Apalah dayaku hp masih samsung a02s;0
Samsung A56;@mahmetmuhammadtitov2705;Tapi pada nyatanya, pas dateng ke store terus ketemu sales oppo semua akan lupa apa yang di jelasin sama bang david ini, karna sales oppo meragakin hp di banting-banting  hp di rebus-rebus  pokoknya langsung tergiur, masa bodo tentang upgrade os ampe 2031;0
Samsung A56;@nontjemunaiseche;A56 Ada ngga yg coba foto camera pake 50mpx ratio full tapi hasil jepretan kaya ke potong bagian bawah ?;0
Samsung A56;@SendalJepitt91;Gw masih pake samsung A5 2017  ( 8 April 2025);0
Samsung A56;@abrahamhariolanang;Stabil banget kameranya;0
Samsung A56;@MukhlisHisbulloh-hi1ci;Bang mau tanya...enakmya ambil a55/a56;0
Samsung A56;@husnulchatimah8793;Micro SD Bagi Saya Penting..;0
Samsung A56;@heriyansyah2707;Berasa kalo desainnya mirip sony exp 1 mark V;0
Samsung A56;@R12Q-j;David gadgetin dukung Jokowi?;0
Samsung A56;@shadiqmoo6103;wort it samsung a56 5g atau ip 12 si bang??;0
Samsung A56;@rraalove13;Cas an nya gajelas jir, baru 3 hari udh ga bs lagi cas an nya, kenapa ya?;0
Samsung A56;@leci_lacotus;Rekomendasi dong bang, untuk charger a36 dan a56 45 watt;0
Samsung A56;@CrosszDragon-c6s9r;A56 hp utama untuk pemakain ringan A52s untuk pemakian game berat, soalnya masih waswas sama performanya Exynos;0
Samsung A56;@AkbarSetia-s6c;Bang bahas Poco M7 Pro bang;0
Samsung A56;@rofrans7611;Sampe sekarang a55 gak ada update android 15;0
Samsung A56;@gibrandaniel6690;motorola edge 60 Fusion dong abg kuuuu;0
Samsung A56;@indrapp;Buat secondary cocok ga ya;0
Samsung A56;@ekoyt26;samsung A56 kalo kmeranya di bndingin sama vivo v50 bagus mana ya?;0
Samsung A56;@putriarum5791;Samsung a51 bezzle tipis tapi udah jadul;0
Samsung A56;@agathaメ;Samsung a56 5g vs redmi note 13 pro plus 5g dong ka plissss;0
Samsung A56;@havefunaja1910;Tidak ada memory eksternalnyakah;0
Samsung A56;@pancaananda5713;Misi bang baru masuk dunia handphone ini a56 kalo bulan juli bakal turun berpa ya harganya soalnya mau nabung 1jt perbulan;0
Samsung A56;@JakiMustopa-kf4jd;Mau tanya bang david, spil dong hp android yg punya speker/audio kualitas suaranya sama atau ampir sama dengan kualitas speker/audio/suara  iphone ,;0
Samsung A56;@Ilhamsyah-g7d;kok aku rekam di low light agak jitter hasil nya, memang begitu ya;0
Samsung A56;@foxee23;8:14 makin tebel bazelnya makin minim kena garis ijo;0
Samsung A56;@gordon1999;Sinyalnya kuat nggak ya?;0
Samsung A56;@endiirawan3404;Saya nonton ini masih pake a52s;0
Samsung A56;@ambilyangbaik1382;Ada 4k 60fps nya ga bang A56?;0
Samsung A56;@mugynagara3186;bg kalau pakai adaptor lebih dari 45 wat itu berdampak gak ya ke performa Hp nya;0
Samsung A56;@ampyangjawa;mau beli..tapi apakah nanti masih kena lightsaber ?;0
Samsung A56;@tutwurihandayanihandayani-d6h;Laah. kappan pembaruan softwere hp² samsung  dibawahnya. ini sdh bln 4;0
Samsung A56;@aprohdite_glen;"Dapet A56 5G 12/256GB di angka 6,699jt di ofline store Samsung Mall Taman Anggrek + Tambah Charger 45W 500rb. Total 7,199jt

Yang saya sayangkan di A56 ini kenapa di harga segitu gk bisa dapet yg 512GB aja sih.";1
Samsung A56;@ilhamarifiansyah9742;Antara memory 8/256 dan 12/256 apakah ada fitur yg berbeda?;0
Samsung A56;@nitapandjaitan8824;Skip A56;0
Samsung A56;@officialaroel4422;bagus ini;0
Samsung A56;@RidwanMaulidan-r5t;maaf bg, a56 rawan light saber ga ?;0
Samsung A56;@HeruLegacy;Udah support esim belum ya ?;0
Samsung A56;@rizqiachdian5933;"Kenapa ya hp2 skrg penjualan ny gada casan nya
Bkin repot aja hrus cari2 lg charger ori nya
Hadeeh";0
Samsung A56;@Okidk-f5l;Hp pribadi gw ttp iPhone tp klo kantor ttp gw hajar samsung;0
Samsung A56;@BRStory22;Cobak dong Samsung cargingnya di upgrade lagi masak kalah sama hp2 cina yang lebih cepet;0
Samsung A56;@djjanioofficial8241;Maaf mau tanya, kalau kita beli yang serie A56 kan gk dapet Kepala Charger, terus kalo kita beli pisah kira'' ukuran watt nya berapa ya? Soalnya kan kalau beli pisah takutnya nanti gk cocok, nanti batrenya yang kena lagi;0
Samsung A56;@mortezabarraka8309;"Mau tanya,
Lg bingung..A56 / 14t Pro?";0
Samsung A56;@shintaratnasari688;Nonton pake a51;0
Samsung A56;@aditiyasaputra787;bang update sistem samsung itu wajib ga sih;0
Samsung A56;@shaqz34;2025 masih pake A52;0
